{"counts":{"nonblank_cells":6,"rows":2,"sheets":1},"extractor_version":"dcs-lossless-extractor/1.0","schema_version":"dcs-source-tables/1.0","sheets":[{"index":1,"max_column":3,"max_row":2,"name":"Debt","rows":[{"cells":[{"address":"A1","cell_id":"s001!A1","cell_sha256":"697708949ddc1df241c1273402db1fed96a4d6f99f5f9bc98443b08aa8701db5","column":1,"display_value":"Instrument","formula":null,"raw_value":"Instrument","row":1,"style_index":0,"value_type":"text"},{"address":"B1","cell_id":"s001!B1","cell_sha256":"3622ad51a33cb5115684aa809e54e41bff79b04caf4bb957d4cc88a791369449","column":2,"display_value":"Outstanding","formula":null,"raw_value":"Outstanding","row":1,"style_index":0,"value_type":"text"},{"address":"C1","cell_id":"s001!C1","cell_sha256":"5f9a44dc3ecab4559e46fa4fe208e83b189c687ba043e3f44fcdb03ac50bfd12","column":3,"display_value":"Maturity","formula":null,"raw_value":"Maturity","row":1,"style_index":0,"value_type":"text"}],"row":1,"row_id":"s001!row:1","row_sha256":"a4a24f4aef62fe510e8dd50cac48f2389fd3db978054efdfa8db3d82ee67a095"},{"cells":[{"address":"A2","cell_id":"s001!A2","cell_sha256":"964f5106b84de89be870cea51ff11749d77184e14f8cffda1ff86fb4b52e81a8","column":1,"display_value":"Zero RCF","formula":null,"raw_value":"Zero RCF","row":2,"style_index":0,"value_type":"text"},{"address":"B2","cell_id":"s001!B2","cell_sha256":"350f96bf28e7866447f54f5c2cf7eec002799c3b478eb41d70ac8191167f6c6d","column":2,"display_value":0,"formula":null,"raw_value":"0","row":2,"style_index":0,"value_type":"number"},{"address":"C2","cell_id":"s001!C2","cell_sha256":"0acfb6f75aeb5462511070612a0b986ae1eb1d85ab3734ba09bd8d5fc9b036d6","column":3,"date_system":"1900","display_value":"1900-01-01","formula":null,"number_format":"mm-dd-yy","raw_value":"1","row":2,"style_index":1,"value_type":"date"}],"row":2,"row_id":"s001!row:2","row_sha256":"bd2b4135b7fa7e73aca7149303bbf89e8d8f57952a9e66493a64d8dad14bdee9"}],"sheet_id":"s001","sheet_sha256":"00e8c22cb83cea58ee471b333c7998b2c11cc877556b0733bbd076c686673f60"}],"source":{"byte_size":2338,"filename":"controlled.xlsx","media_type":"application/vnd.openxmlformats-officedocument.spreadsheetml.sheet","sha256":"3d8c94bb44792c95105d5b9230d979c08c8d2fc80fa800de8b78502c04f6f49e"}}
