{"counts":{"nonblank_cells":21,"rows":2,"sheets":1},"extractor_version":"dcs-lossless-extractor/1.0","schema_version":"dcs-source-tables/1.0","sheets":[{"index":1,"max_column":16,"max_row":2,"name":"deficient","rows":[{"cells":[{"address":"A1","cell_id":"s001!A1","cell_sha256":"89dad32885fec8b6d053988c7f435322cf861fa42d39442d4267a6dc2819a5d4","column":1,"display_value":"Security Description","formula":null,"raw_value":"Security Description","row":1,"value_type":"text"},{"address":"B1","cell_id":"s001!B1","cell_sha256":"c9535b0fa5c4e54f61a071b40ea83b479299513a41878750b7b243c5de77548e","column":2,"display_value":"Security Type","formula":null,"raw_value":"Security Type","row":1,"value_type":"text"},{"address":"C1","cell_id":"s001!C1","cell_sha256":"d3e1f1a5526005644ae24e7a22c629d2d96311216e81fd031acdc5a29908941e","column":3,"display_value":"CCY","formula":null,"raw_value":"CCY","row":1,"value_type":"text"},{"address":"D1","cell_id":"s001!D1","cell_sha256":"6f1394827879544e249521ba4eb90f8111291ae0dccb49d363adc5731135417a","column":4,"display_value":"Amount Outstanding","formula":null,"raw_value":"Amount Outstanding","row":1,"value_type":"text"},{"address":"E1","cell_id":"s001!E1","cell_sha256":"e9bbe9fa00a3495309e780697de38f16e776bb6e354013766b3b4821e77caf74","column":5,"display_value":"Maturity Date","formula":null,"raw_value":"Maturity Date","row":1,"value_type":"text"},{"address":"F1","cell_id":"s001!F1","cell_sha256":"84a1342bbb554f620bc7ec13b0ca2d89e84b0079fa163c129a245886cfbd8e77","column":6,"display_value":"Coupon Rate","formula":null,"raw_value":"Coupon Rate","row":1,"value_type":"text"},{"address":"G1","cell_id":"s001!G1","cell_sha256":"011ce7385cdcf2806cb5000889aabddc097daa76d50338b0bfe51db67724d583","column":7,"display_value":"Balance Basis","formula":null,"raw_value":"Balance Basis","row":1,"value_type":"text"},{"address":"H1","cell_id":"s001!H1","cell_sha256":"810f463ee51eca0330536bb5d4ff1d1634cb97e32bc40482aca6ffe342c30568","column":8,"display_value":"Facility Size","formula":null,"raw_value":"Facility Size","row":1,"value_type":"text"},{"address":"I1","cell_id":"s001!I1","cell_sha256":"3311492112f4083896a95c751e611016b682f9f98428ec4018245e9d1d360e87","column":9,"display_value":"Amount Drawn","formula":null,"raw_value":"Amount Drawn","row":1,"value_type":"text"},{"address":"J1","cell_id":"s001!J1","cell_sha256":"cb9c718f21de393eac1690244ac0c29457bed5fcc45e6efa6b66fca0c46be193","column":10,"display_value":"Committed","formula":null,"raw_value":"Committed","row":1,"value_type":"text"},{"address":"K1","cell_id":"s001!K1","cell_sha256":"b9b6c4672b4cd20b6d091437b47c8b1bc02b69b685e5e755a3d78cbe1ab5293a","column":11,"display_value":"Fee Convention","formula":null,"raw_value":"Fee Convention","row":1,"value_type":"text"},{"address":"L1","cell_id":"s001!L1","cell_sha256":"0429358cedc5b4895db0d61a0a72583a66a67b7459f98917f5ae4feba9b2fc91","column":12,"display_value":"Commitment Fee Bps","formula":null,"raw_value":"Commitment Fee Bps","row":1,"value_type":"text"},{"address":"M1","cell_id":"s001!M1","cell_sha256":"f6c07a928a28b69bd4b80ebce477140ba708bfec3b229c6a23f57dfe8d76861b","column":13,"display_value":"Issue Date","formula":null,"raw_value":"Issue Date","row":1,"value_type":"text"},{"address":"N1","cell_id":"s001!N1","cell_sha256":"431d6cd0ed9af514f3249602741061c303d6d8edff4ce100d558f862f0287b73","column":14,"display_value":"Clean Price","formula":null,"raw_value":"Clean Price","row":1,"value_type":"text"},{"address":"O1","cell_id":"s001!O1","cell_sha256":"e7821725edc969f6fa21e424337184610a728cb12fdd628e15dc8aeba9bd64e0","column":15,"display_value":"YTW","formula":null,"raw_value":"YTW","row":1,"value_type":"text"},{"address":"P1","cell_id":"s001!P1","cell_sha256":"e205bf42f93db2ea5f30b6f80eecc42a6cb83d4db5e0e852a6f281412395060d","column":16,"display_value":"OAS","formula":null,"raw_value":"OAS","row":1,"value_type":"text"}],"row":1,"row_id":"s001!row:1","row_sha256":"a0b7e87ba5ae414791d54008fc12cdff272954b2222ab2bae341db5d74dba6fb"},{"cells":[{"address":"A2","cell_id":"s001!A2","cell_sha256":"cf1c3e64c7210994f63b8e4957820100e002133fdb52502a2cac265a799329f3","column":1,"display_value":"Missing Terms Loan","formula":null,"raw_value":"Missing Terms Loan","row":2,"value_type":"text"},{"address":"B2","cell_id":"s001!B2","cell_sha256":"a9e63342b55f3e1e76c910e753a371fe4651ee20beedb9e8a20a9083c65939f0","column":2,"display_value":"loan","formula":null,"raw_value":"loan","row":2,"value_type":"text"},{"address":"C2","cell_id":"s001!C2","cell_sha256":"4d65f178ed1d18e5a7518217edaa6f314f40798c580ecd3bfee259be2aa1fd00","column":3,"display_value":"USD","formula":null,"raw_value":"USD","row":2,"value_type":"text"},{"address":"D2","cell_id":"s001!D2","cell_sha256":"29f6b6fdf4025d30c5c63b9b454e819495060b11e034b5c085f4676108bc5a9d","column":4,"display_value":"73","formula":null,"raw_value":"73","row":2,"value_type":"text"},{"address":"G2","cell_id":"s001!G2","cell_sha256":"454b61829f959be8de2e90663595c113f65e504b2524901cbc950be6dba1f1b9","column":7,"display_value":"reporting_currency_carrying_value","formula":null,"raw_value":"reporting_currency_carrying_value","row":2,"value_type":"text"}],"row":2,"row_id":"s001!row:2","row_sha256":"44da79fda475aefac094f99df10550a51cf5bb0db189e6d19e3a77e2e495c04f"}],"sheet_id":"s001","sheet_sha256":"30eeb4cd2d662299ff6a4b79443f65b6aca4731e04f85ac47152a410a8d7d931"}],"source":{"byte_size":278,"filename":"deficient.csv","media_type":"text/csv","sha256":"2cab4e5bfa22e6cbd9615183a197015fded156764a228fae204a2e138319a578"}}
